{
  "final_decision": "conditional_go",
  "fixtures": [
    {
      "category": "python_repo",
      "display_alias": "operator_python_fixture",
      "fixture_id": "fixture-1",
      "measurements": {
        "blocker_classification": "post_alpha_backlog",
        "branch_default_branch_behavior": "Operator-owned Python checkout exercised default-branch-neutral file discovery; documented default-branch tracking remains the production policy.",
        "first_index_time_seconds": 0.041,
        "install_time_seconds": 32.864,
        "log_noise_classification": "low",
        "query_latency_p50_ms": 39.289,
        "query_latency_p95_ms": 39.289,
        "result_quality_notes": "Matched 1/1 expected path fragments in redacted fixture checks.",
        "rollback_rebuild_behavior": "Release smoke rebuild path completed during this evidence run."
      }
    },
    {
      "category": "typescript_js_repo",
      "display_alias": "operator_typescript_fixture",
      "fixture_id": "fixture-2",
      "measurements": {
        "blocker_classification": "post_alpha_backlog",
        "branch_default_branch_behavior": "Operator-owned TypeScript checkout exercised default-branch-neutral file discovery.",
        "first_index_time_seconds": 0.089,
        "install_time_seconds": 32.864,
        "log_noise_classification": "low",
        "query_latency_p50_ms": 84.544,
        "query_latency_p95_ms": 84.544,
        "result_quality_notes": "Matched 1/1 expected path fragments in redacted fixture checks.",
        "rollback_rebuild_behavior": "Release smoke rebuild path completed during this evidence run."
      }
    },
    {
      "category": "mixed_docs_code_repo",
      "display_alias": "operator_mixed_docs_code_fixture",
      "fixture_id": "fixture-3",
      "measurements": {
        "blocker_classification": "post_alpha_backlog",
        "branch_default_branch_behavior": "Operator-owned mixed docs/code checkout exercised branch-neutral file discovery across Markdown and TypeScript.",
        "first_index_time_seconds": 0.001,
        "install_time_seconds": 32.864,
        "log_noise_classification": "low",
        "query_latency_p50_ms": 0.289,
        "query_latency_p95_ms": 0.518,
        "result_quality_notes": "Matched 2/2 expected path fragments in redacted fixture checks.",
        "rollback_rebuild_behavior": "Release smoke rebuild path completed during this evidence run."
      }
    },
    {
      "category": "multi_repo_workspace",
      "display_alias": "operator_multi_repo_fixture",
      "fixture_id": "fixture-4",
      "measurements": {
        "blocker_classification": "post_alpha_backlog",
        "branch_default_branch_behavior": "Operator-owned nested workspace exercised file discovery across root and nested repository boundaries; registered-repo default-branch tracking remains covered by the multi-repo tests.",
        "first_index_time_seconds": 0.073,
        "install_time_seconds": 32.864,
        "log_noise_classification": "low",
        "query_latency_p50_ms": 34.837,
        "query_latency_p95_ms": 63.454,
        "result_quality_notes": "Matched 2/2 expected path fragments in redacted fixture checks.",
        "rollback_rebuild_behavior": "Release smoke rebuild path completed during this evidence run."
      }
    },
    {
      "category": "large_ignored_vendor_repo",
      "display_alias": "operator_large_vendor_fixture",
      "fixture_id": "fixture-5",
      "measurements": {
        "blocker_classification": "post_alpha_backlog",
        "branch_default_branch_behavior": "Operator-owned vendor-heavy checkout exercised discovery in a repo containing ignored/generated dependency directories.",
        "first_index_time_seconds": 0.122,
        "install_time_seconds": 32.864,
        "log_noise_classification": "low",
        "query_latency_p50_ms": 121.124,
        "query_latency_p95_ms": 121.124,
        "result_quality_notes": "Matched 1/1 expected path fragments in redacted fixture checks.",
        "rollback_rebuild_behavior": "Release smoke rebuild path completed during this evidence run."
      }
    }
  ],
  "generated_at": "2026-04-22T23:04:35+00:00",
  "known_issues": [
    {
      "classification": "documented_limitation",
      "disposition": "Acceptable for public-alpha readiness smoke; repeat with named customer opt-in repositories before stable release.",
      "id": "P26-LOCAL-001",
      "summary": "Private-alpha evidence uses operator-owned local repositories selected on this workstation rather than external customer repositories."
    },
    {
      "classification": "post_alpha_backlog",
      "disposition": "Keep the conservative harness for public alpha and extend retrieval scoring before stable release.",
      "id": "P26-LOCAL-002",
      "summary": "Harness quality checks currently use redacted path-fragment matching rather than full MCP semantic relevance scoring."
    }
  ],
  "run_id": "p26-local-fixture-rerun-20260422",
  "schema_version": "1.0"
}
